{
  "conflicts": [],
  "files": [
    ".agents/shared/references/domain-records.md",
    ".agents/shared/references/execution-package.md",
    ".agents/shared/references/operating-contract.md",
    ".agents/shared/references/routing.md",
    ".agents/shared/references/testing.md",
    ".agents/shared/references/vocabulary.md",
    ".agents/shared/schemas/config.schema.json",
    ".agents/shared/schemas/evidence.schema.json",
    ".agents/shared/schemas/finding.schema.json",
    ".agents/shared/schemas/install-manifest.schema.json",
    ".agents/shared/schemas/plan.schema.json",
    ".agents/shared/schemas/spec.schema.json",
    ".agents/shared/schemas/state.schema.json",
    ".agents/shared/schemas/ticket.schema.json",
    ".agents/shared/templates/adr.md",
    ".agents/shared/templates/compact/change.md",
    ".agents/shared/templates/context.md",
    ".agents/shared/templates/discovery.md",
    ".agents/shared/templates/project/roadmap.md",
    ".agents/shared/templates/project/vision.md",
    ".agents/shared/templates/standard/plan.md",
    ".agents/shared/templates/standard/review.md",
    ".agents/shared/templates/standard/spec.md",
    ".agents/shared/templates/standard/ticket.md",
    ".agents/skills/hybrid-check/SKILL.md",
    ".agents/skills/hybrid-discover/SKILL.md",
    ".agents/skills/hybrid-domain/SKILL.md",
    ".agents/skills/hybrid-implement/SKILL.md",
    ".agents/skills/hybrid-plan/SKILL.md",
    ".agents/skills/hybrid-review/SKILL.md",
    ".agents/skills/hybrid-slice/SKILL.md",
    ".agents/skills/hybrid-specify/SKILL.md",
    ".agents/skills/hybrid-start/SKILL.md",
    ".agents/skills/hybrid-verify/SKILL.md",
    ".hybrid/hybrid.py",
    ".hybrid/shared/references/domain-records.md",
    ".hybrid/shared/references/execution-package.md",
    ".hybrid/shared/references/operating-contract.md",
    ".hybrid/shared/references/routing.md",
    ".hybrid/shared/references/testing.md",
    ".hybrid/shared/references/vocabulary.md",
    ".hybrid/shared/schemas/config.schema.json",
    ".hybrid/shared/schemas/evidence.schema.json",
    ".hybrid/shared/schemas/finding.schema.json",
    ".hybrid/shared/schemas/install-manifest.schema.json",
    ".hybrid/shared/schemas/plan.schema.json",
    ".hybrid/shared/schemas/spec.schema.json",
    ".hybrid/shared/schemas/state.schema.json",
    ".hybrid/shared/schemas/ticket.schema.json",
    ".hybrid/shared/templates/adr.md",
    ".hybrid/shared/templates/compact/change.md",
    ".hybrid/shared/templates/context.md",
    ".hybrid/shared/templates/discovery.md",
    ".hybrid/shared/templates/project/roadmap.md",
    ".hybrid/shared/templates/project/vision.md",
    ".hybrid/shared/templates/standard/plan.md",
    ".hybrid/shared/templates/standard/review.md",
    ".hybrid/shared/templates/standard/spec.md",
    ".hybrid/shared/templates/standard/ticket.md"
  ],
  "schema_version": "1.0",
  "skill_root": ".agents/skills",
  "source": "/tmp/claude-0/-root-saas-entrepreneur-agent/57e6ec7c-8613-4d0c-a8d1-db1a087e445a/scratchpad/dev-skills/hybrid-spec-kit",
  "timestamp": "2026-09-28T14:05:48+00:00"
}
